[
 {"id":"treaty-shimonoseki-1895","act":"IV","kind":"event","names":{"en":"Treaty of Shimonoseki cedes Taiwan to Japan","zh":"馬關條約"},"start_year":1895,"end_year":null,"date_note":"Signed 17 April 1895","geometry":null,"certainty":"documented","confidence":"verified","status":"draft","card":{"en":"Under Article 2 of the treaty that ended the First Sino-Japanese War, the Qing court ceded Taiwan and the Penghu islands to Japan. Taiwan's residents, including indigenous peoples who held most of the mountain areas, were not parties to it."},"indigenous_thread":"Much of the interior was not under effective Qing administration in 1895; the treaty transferred a claim, not control.","sources":["shimonoseki1895"],"notes":"Vocabulary: 'cession' (treaty term). Check 'not effective control' phrasing against Barclay before publish.","reviewer":null},
 {"id":"republic-of-formosa-1895","act":"IV","kind":"event","names":{"en":"Republic of Formosa (short-lived resistance state)","zh":"台灣民主國"},"start_year":1895,"end_year":1895,"date_note":"Proclaimed May 1895; collapsed by October 1895 (exact dates to confirm)","geometry":null,"certainty":"documented","confidence":"partly-verified","status":"draft","card":{"en":"A short-lived republic proclaimed by Qing officials and local elites in opposition to the cession. It collapsed within months as Japanese forces advanced south. Historians debate how far it was a true independence project versus a loyalist stopgap."},"sources":["ching2001"],"notes":"Confirm exact dates and the 'loyalist vs independence' debate with a dedicated academic source. Draft.","reviewer":null},
 {"id":"land-survey-1898","act":"IV","kind":"governance","names":{"en":"Cadastral land survey","zh":"土地調查事業"},"start_year":1898,"end_year":1905,"geometry":null,"certainty":"documented","confidence":"partly-verified","status":"draft","card":{"en":"The colonial government surveyed land holdings, clarifying titles and widening the tax base. It also reclassified much upland and forest as state land, which affected indigenous communities."},"indigenous_thread":"State claim over uplands and forests removed customary hunting and farming territories from indigenous control.","sources":["ka1995"],"notes":"Verify end year and the forest/upland claim with page refs.","reviewer":null},
 {"id":"western-line-rail-1908","act":"IV","kind":"infrastructure","names":{"en":"Western trunk railway completed (Keelung to Kaohsiung)","zh":"縱貫鐵路"},"start_year":1899,"end_year":1908,"date_note":"Construction on Japanese-era sections began in 1899; completion ceremony 1908 (confirm). Earlier Qing line Keelung to Hsinchu built c. 1887-1893.","geometry":null,"certainty":"documented","confidence":"partly-verified","status":"draft","card":{"en":"The north-south railway linked ports, sugar districts and cities, and moved troops as well as goods. Part of it reused the Qing-era Keelung to Hsinchu line."},"sources":["ka1995"],"notes":"Do NOT claim 'first railway in China'. Check Qing segment dates and mileage. Needs line geometry (stations list).","reviewer":null},
 {"id":"chianan-irrigation-1930","act":"IV","kind":"infrastructure","names":{"en":"Chianan Irrigation System and Wushantou Reservoir","zh":"嘉南大圳 / 烏山頭水庫"},"start_year":1920,"end_year":1930,"date_note":"Built 1920 to 1930 under engineer Hatta Yoichi (confirm)","geometry":null,"certainty":"documented","confidence":"unverified","status":"draft","card":{"en":"A large irrigation network in the Chianan plain that expanded paddy and sugarcane farming. Its legacy is remembered differently by different communities, including the farmers who paid water fees."},"sources":["todo-chianan"],"notes":"Needs primary or official source and an academic source on costs and burden before use.","reviewer":null},
 {"id":"musha-incident-1930","act":"IV","kind":"event","names":{"en":"Musha (Wushe) Incident","zh":"霧社事件","indigenous":"TODO: Seediq endonym via community consultation"},"start_year":1930,"end_year":1931,"date_note":"Began 27 October 1930","geometry":null,"certainty":"documented","confidence":"partly-verified","status":"draft","card":{"en":"Seediq fighters attacked Japanese people at Musha. Colonial forces responded with a large military campaign. A second violent episode against surviving Seediq followed in 1931."},"indigenous_thread":"Must be told from Seediq perspectives; consult Seediq community and scholars before publish.","sources":["barclay2018"],"notes":"Earlier chat flagged wording on chemical weapons; use only a well-sourced, measured statement. Sensitive: consent and review required.","reviewer":null},
 {"id":"bangchunfeng-1933","act":"IV","kind":"fact","names":{"en":"'Bangchunfeng' (Waiting for the Spring Breeze)","zh":"望春風"},"start_year":1933,"end_year":null,"geometry":null,"certainty":"documented","confidence":"partly-verified","status":"draft","card":{"en":"A Taiwanese-language popular song with music by Teng Yu-hsien and lyrics by Lee Lin-chiu, from the early 1930s. It is a landmark of Taiwanese-language popular music."},"sources":["todo-bangchunfeng"],"notes":"Rights: composition by Teng treated as public domain; Lee's lyrics protected in Taiwan to end of 2029 (per Blueprint). Do not display lyrics. Use only a new or licensed recording (see music_tracker.csv).","reviewer":null},
 {"id":"myth-japan-only-built-1","act":"IV","kind":"myth-vs-fact","names":{"en":"Myth: 'Japan built modern Taiwan' vs 'Japan only extracted'"},"start_year":1895,"end_year":1945,"geometry":null,"certainty":"disputed","confidence":"partly-verified","status":"draft","card":{"en":"Both simple stories fail.","myth":"Colonial rule was either purely beneficial modernization or purely extraction.","fact":"Infrastructure and public health expanded, and the system was designed to serve imperial and colonial-state interests, with unequal legal and economic treatment. Historians weigh these differently."},"sources":["ka1995","ching2001"],"notes":"Present as an open debate. Add Taiwanese-language scholarship.","reviewer":null}
]
